candidate_label,overall_disposition,lt1_status,lt2_status,lt3_status,primary_use_case,keep_for_step5,keep_for_live_monitoring,representative_of_group,preferred_over,excluded_reason,rationale_short
E0,CONDITIONAL_DEPLOY,ALLOW,RECOMMEND,DO_NOT_RECOMMEND,LT2 fallback binary; lowest delay fragility of E0-class,yes,yes,binary_base,none,none,"Least delay-fragile binary. Inferior raw Sharpe to E5/E0_plus/E5_plus but most resilient under degraded latency."
E5,CONDITIONAL_DEPLOY,ALLOW,ALLOW,DO_NOT_RECOMMEND,LT2 alternative when robust ATR is preferred,yes,yes,binary_enhanced,none,none,"Beats E0 at all cost levels. LT2 fallback for E5_plus. WFO 4/8 (marginal)."
SM,PRIMARY_DEPLOY,ALLOW,RECOMMEND,RECOMMEND,Resilience-first mandate; degraded/manual ops,yes,yes,vol_target,LATCH,"none","Best vol-target representative. Operationally robust at all latency tiers. Low CAGR acceptable under M3."
LATCH,DROP_REDUNDANT,ALLOW,ALLOW,ALLOW,none (SM is preferred),no,no,vol_target (redundant),none,"Near-duplicate of SM with higher complexity and zero measurable benefit","Hysteresis mechanism adds ~5 params with identical trade structure and replay fragility vs SM."
E0_plus_EMA1D21,PRIMARY_DEPLOY,RECOMMEND,ALLOW,DO_NOT_RECOMMEND,Default balanced deployment under LT1,yes,yes,binary_ema,E0 under LT1,"none","Only strategy to pass ALL Tier 1 gates. WFO 6/8 (best). Most defensible binary for deployment."
E5_plus_EMA1D21,PRIMARY_DEPLOY,RECOMMEND,DO_NOT_RECOMMEND,DO_NOT_RECOMMEND,Maximum return-seeking under LT1,yes,yes,binary_ema,E5 under LT1,"none","Highest raw Sharpe (1.430). Requires strict LT1. Performance evaporates beyond D2 delay."
